{
  "candidate_set": [
    "api-a"
  ],
  "dependency": false,
  "dependency_reason": "structurally_valid_path_remaining_after_projection",
  "dependency_result_hash": "sha256:ec941a1a7e263adcbac4560c9f09777e5a3c7b58081ce837d3e7c69943267346",
  "diagnostics": [
    {
      "code": "DEPENDENCY.FALSE",
      "message": "candidate set is not a structural dependency",
      "severity": "info",
      "subject": {
        "id": "checkout",
        "kind": "workload"
      }
    },
    {
      "code": "DEPENDENCY.REACHABILITY_REMAINING",
      "message": "projected reachability remains",
      "severity": "info",
      "subject": {
        "id": "checkout",
        "kind": "workload"
      }
    }
  ],
  "normalized_ir_hash": "sha256:0000000000000000000000000000000000000000000000000000000000000000",
  "projected_ir_hash": "sha256:1111111111111111111111111111111111111111111111111111111111111111",
  "reachability_result_hash": "sha256:2222222222222222222222222222222222222222222222222222222222222222",
  "reachable_after_projection": [
    "client",
    "api-b",
    "database"
  ],
  "roots": [
    "client"
  ],
  "schema_version": "dependency-algebra.dependency.v1",
  "target": "database",
  "workload_id": "checkout"
}
